{"type":"config","name":"ternary-nanogpt-fast-recipe","metricName":"val_loss","metricUnit":"nats","bestDirection":"lower"}
{"run":1,"commit":"101919c","metric":4.0645,"metrics":{"loss_ema":3.6922,"flip_rate":2.164028e-04,"frac_zero_delta":-0.071979,"wall_seconds":7877,"val_step_500":5.4957,"val_step_1000":4.9801,"val_step_1500":4.7260,"val_step_2000":4.6085,"val_step_2500":4.4352,"val_step_3000":4.3426,"val_step_3500":4.2355,"val_step_4000":4.1535,"val_step_4500":4.0920,"val_step_5000":4.0645},"status":"keep","description":"BASELINE: 6-layer ternary GPT (fast-A geometry: hidden=512, heads=8, ff=1408, ~44.7M params, 19.3M trits + 25.2M FP embeddings). Recipe transferred from HRM champion: random scales lognormal frozen, freeze non-embed FP, CMuon-STE cautious lr=0.20 cosine, default 70/25/5 mix, 5000 steps. val 4.0645 — BEATS HRM r042 Phase A (same recipe at fast-A) by -0.073 nats AT HALF THE WALL TIME (7877s vs ~15000s for HRM). Confirms recurrence-free GPT is the right autoresearch substrate for ternary speedups. Trajectory still descending at step 5000 (last 500 -0.027). New ternary-nanoGPT leaderboard floor.","timestamp":1781654653,"segment":0}
{"run":2,"commit":"7830165","metric":4.1335,"metrics":{"loss_ema":3.7722,"flip_rate":2.139847e-04,"frac_zero_delta":-0.074141,"wall_seconds":7691,"val_step_500":5.5739,"val_step_1000":5.1756,"val_step_1500":4.8347,"val_step_2000":4.7089,"val_step_2500":4.5391,"val_step_3000":4.4453,"val_step_3500":4.3169,"val_step_4000":4.2341,"val_step_4500":4.1607,"val_step_5000":4.1335},"status":"keep","description":"Q-K=V (arxiv 2606.04032): share W_K and W_V projections. Param count 44.74M → 43.14M (-1.60M, -8pct of trits). val 4.1335 vs g001 4.0645 = +0.069 nats (+1.7pct PPL, well below the +5pct pass bar; paper reported +2.48pct at 1.2B). Wall 7691s vs g001 7877s = -2.4pct (one fewer projection per attention block). PROMOTED to baseline: all future runs use --share-kv unless explicitly ablated.","timestamp":1781696237,"segment":0}
{"run":3,"commit":"fbbb03b","metric":4.1281,"metrics":{"loss_ema":3.7613,"flip_rate":2.159808e-04,"frac_zero_delta":-0.075335,"wall_seconds":7871,"val_step_500":5.5496,"val_step_1000":5.1325,"val_step_1500":4.8321,"val_step_2000":4.6921,"val_step_2500":4.5132,"val_step_3000":4.4297,"val_step_3500":4.3069,"val_step_4000":4.2167,"val_step_4500":4.1525,"val_step_5000":4.1281},"status":"keep","description":"Phase 1 #2: CMuon momentum dtype bf16 (was fp32). val 4.1281 vs g002 4.1335 = -0.005 nats (noise). Wall +180s (~+2.3pct, slight dtype-cast overhead in EMA update). PROMOTED to baseline. Memory: CMuon m buffer for 17.7M trits drops 70.8MB→35.4MB. bf16 dtype keeps fp32 range; only mantissa truncated. NS5 still fp32 internally.","timestamp":1781704192,"segment":0}
{"run":4,"commit":"27eb6a7","metric":4.1609,"metrics":{"loss_ema":3.7912,"flip_rate":3.778325e-04,"frac_zero_delta":-0.081120,"wall_seconds":8204,"val_step_4000_pre":4.2682,"val_step_4500":4.1939,"val_step_5000":4.1609},"status":"discard","description":"CMuon LR sweep leg 1: muon-lr=0.30 (up from g003's 0.20). val 4.1609 vs g003 4.1281 = +0.033 nats (+0.8pct). lr=0.30 WORSE → optimum at or below 0.20, sweep down to 0.15 next. Note: SIGINT'd at step 4430 to validate resume path; trainer auto-resumed cleanly from interrupted.pt and ran to step 5000. Discovered minor harness issue: tee truncated train.log on resume (lost pre-SIGINT vals); fixed with tee -a in this commit. Wall is approximate combined (7063s pre + 1141s post). Discard from leaderboard.","timestamp":1781713045,"segment":0}
{"run":5,"commit":"14b9812","metric":4.1147,"metrics":{"loss_ema":3.7608,"flip_rate":1.137514e-04,"frac_zero_delta":-0.064722,"wall_seconds_resume_tail":2273,"val_step_500":5.5738,"val_step_1000":5.1027,"val_step_1500":4.7834,"val_step_2000":4.6612,"val_step_2500":4.4869,"val_step_3000":4.4084,"val_step_3500":4.3003,"val_step_4000":4.2073,"val_step_4500":4.1380,"val_step_5000":4.1147},"status":"keep","description":"CMuon LR sweep leg 2: muon-lr=0.15 (down from g003's 0.20). val 4.1147 vs g003 4.1281 = -0.013 nats (best so far). 0.15 IS better than 0.20 → optimum below 0.20, continue down to 0.10. Hybrid run: bs=2 ga=16 for first 3635 steps (1.55s/it), bs=4 ga=8 for the resume tail (much faster wall, same effective batch 32). interrupted.pt-based resume across batch shape change works. tee -a harness fix preserved both segments in train.log. bs=4 ga=8 adopted as new baseline going forward.","timestamp":1781721168,"segment":0}
{"run":6,"commit":"4890abf","metric":4.1327,"metrics":{"loss_ema":3.7803,"flip_rate":2.606879e-05,"frac_zero_delta":-0.044889,"wall_seconds":7565,"val_step_500":5.4744,"val_step_1000":5.0709,"val_step_1500":4.7630,"val_step_2000":4.6390,"val_step_2500":4.4675,"val_step_3000":4.3921,"val_step_3500":4.2981,"val_step_4000":4.2313,"val_step_4500":4.1680,"val_step_5000":4.1327},"status":"discard","description":"CMuon LR sweep leg 3: muon-lr=0.10 with bs=4 ga=8 (full bs=4 from scratch). val 4.1327 vs g005 0.15 = +0.018 nats (worse). LR optimum BRACKETED: 0.30 (4.16) > 0.20 (4.13) > 0.15 (4.11) > 0.10 (4.13) — g005 lr=0.15 is the GPT optimum. Wall 7565s ≈ g005's combined ~7773s and g003's bs=2 7877s — bs=4 saves ~5pct kernel-launch overhead at this scale, not 2x. Total wall is dominated by tokens-per-step which is constant across bs/ga splits of effective batch 32. Discarded from leaderboard.","timestamp":1781728816,"segment":0}
{"run":7,"commit":"fc8c547","metric":4.0085,"metrics":{"loss_ema":3.7298,"flip_rate":2.186618e-04,"frac_zero_delta":-0.078004,"wall_seconds":15172,"val_step_500":5.3304,"val_step_1000":4.8149,"val_step_1500":4.5662,"val_step_2000":4.4187,"val_step_2500":4.3211,"val_step_3000":4.2354,"val_step_3500":4.1540,"val_step_4000":4.0877,"val_step_4500":4.0355,"val_step_5000":4.0085},"status":"keep","description":"Phase 1 #7b: effective-batch sweep. lr=0.15 + bs=2 ga=32 (eff batch 64 vs g005's 32). val 4.0085 vs g005 4.1147 = -0.106 nats (-2.5pct) — NEW CHAMPION at fixed-step protocol. Wall 15172s = 2x g005 (linear in tokens per step at fixed step count). Better val per step, but per-WALL the tradeoff may not be favorable; eff=32 at 10000 steps would likely beat eff=64 at 5000 steps for similar wall. Keeping eff=32 as practical baseline (faster iteration), recording eff=64 as best-known reference.","timestamp":1781744118,"segment":0}
{"run":8,"commit":"2e8b45d","metric":4.7801,"metrics":{"loss_ema":4.4165,"flip_rate":7.034349e-05,"frac_zero_delta":-0.053828,"wall_seconds":8231,"val_step_500":6.2421,"val_step_1000":5.7665,"val_step_1500":5.4462,"val_step_2000":5.3279,"val_step_2500":5.1407,"val_step_3000":5.0374,"val_step_3500":4.9429,"val_step_4000":4.8705,"val_step_4500":4.8066,"val_step_5000":4.7801},"status":"keep","description":"Phase 5a: TRITISE THE EMBEDDINGS. 42.9M of 43.5M params now ternary (98.6pct ternary, FP residual 0.68M = norms + scales). val 4.7801 vs g005 baseline 4.1147 = +0.665 nats (+16pct). Trajectory still descending at step 5000 (-0.027 last 500). KEY: trajectory SLOPES are IDENTICAL (g008 -1.46 nats / 4500 steps vs g005 -1.46 / 4500). The gap is a FLAT OFFSET from worse init — random ternary embedding starts at val 6.24 vs random-normal embedding 5.57. Training dynamics are equivalent. Model trains cleanly, no collapse. Next: test whether unfrozen scales close the offset, then try longer training.","timestamp":1781752958,"segment":0}
{"run":9,"commit":"aad4aab","metric":4.3840,"metrics":{"loss_ema":4.0176,"flip_rate":5.718173e-05,"frac_zero_delta":-0.026004,"wall_seconds":8417,"val_step_500":6.0982,"val_step_1000":5.5638,"val_step_1500":5.1599,"val_step_2000":4.9986,"val_step_2500":4.8336,"val_step_3000":4.7459,"val_step_3500":4.6134,"val_step_4000":5.5414,"val_step_4500":4.4333,"val_step_5000":4.3840},"status":"keep","description":"Phase 5a follow-up: drop --freeze-scales so embedding scales (and all QLinear scales) are Lion-trainable. val 4.3840 vs g008 4.7801 = -0.396 nats (closed 60pct of the gap to g005 baseline 4.1147). 42.9M trits + 0.67M trainable FP scales = 98.5pct ternary, FP residual matches the user's 'block scales where trits not sufficient' goal. Trajectory still descending at step 5000 with steep slope (-0.049/500 vs g005's -0.027/500), suggesting more compute will close the remaining 0.27 nat gap. Wall 8417s. NEW best at trit-emb leaderboard. Phase 5a recipe is now: --random-scales --trit-embeddings (no --freeze-scales).","timestamp":1781761461,"segment":0}
{"run":10,"commit":"7a126a8","metric":4.1609,"metrics":{"loss_ema":3.8853,"flip_rate":7.401493e-05,"frac_zero_delta":-0.031945,"wall_seconds":16924,"val_step_500":6.0164,"val_step_1000":5.5707,"val_step_2000":5.0698,"val_step_5000":4.6435,"val_step_7000":4.4309,"val_step_8000":4.3493,"val_step_9000":4.2517,"val_step_10000":4.1609},"status":"keep","description":"Phase 5a final test: trit-embeddings + unfrozen scales at 10000 steps. val 4.1609 — within 0.046 nats of g005 FP-embed at 5000 steps. Trajectory still descending at end (-0.053 last 500). 98.5pct ternary model essentially matches the FP-embed model at 2x compute. Phase 5a is functionally complete. Residual gap of ~0.2-0.3 nats at matched compute is the precision tax at fast-A scale. The recipe is locked: --trit-embeddings + unfrozen scales (drop --freeze-scales).","timestamp":1781778527,"segment":0}
{"run":11,"commit":"9276c14","metric":4.3731,"metrics":{"loss_ema":4.0138,"flip_rate":5.781635e-05,"frac_zero_delta":-0.027813,"wall_seconds":8511,"val_step_500":6.1127,"val_step_1000":5.5497,"val_step_1500":5.1603,"val_step_2000":4.9999,"val_step_2500":4.8235,"val_step_3000":4.7386,"val_step_3500":4.6177,"val_step_4000":4.5362,"val_step_4500":4.4342,"val_step_5000":4.3731},"status":"keep","description":"Phase 5 follow-up: drop --random-scales (unit-scale init for trainable scales). val 4.3731 vs g009 4.3840 = -0.011 nats (noise). Trajectory marginally better at end, marginally worse at start. Conclusion: init scheme for scales is not the lever. Adopt unit-scale init as default for the trit-emb recipe (cleaner / one fewer flag).","timestamp":1781787140,"segment":0}
{"run":12,"commit":"0b89b32","metric":4.4499,"metrics":{"loss_ema":4.0904,"flip_rate":5.582757e-06,"frac_zero_delta":-0.019855,"wall_seconds":8433,"val_step_500":6.1130,"val_step_1000":5.6312,"val_step_1500":5.2424,"val_step_2000":5.0507,"val_step_2500":4.8665,"val_step_3000":4.7894,"val_step_3500":4.6738,"val_step_4000":4.6024,"val_step_4500":4.5087,"val_step_5000":4.4499},"status":"discard","description":"Phase 5 LR sweep: trit-emb + lr=0.10 (down from g011's 0.15). val 4.4499 vs g011 4.3731 = +0.077 nats (worse). lr=0.15 stays optimum for trit-emb regime, same as FP-emb regime. LR optimum does not shift between regimes.","timestamp":1781795644,"segment":0}
{"run":13,"commit":"e04210a","metric":4.2016,"metrics":{"loss_ema":3.9106,"flip_rate":8.641234e-05,"frac_zero_delta":-0.047184,"wall_seconds":16797,"val_step_500":5.9549,"val_step_1000":5.2856,"val_step_1500":4.8994,"val_step_2000":4.6983,"val_step_2500":4.5889,"val_step_3000":4.4659,"val_step_3500":4.3806,"val_step_4000":4.3162,"val_step_4500":4.2561,"val_step_5000":4.2016},"status":"keep","description":"COMPOUND wins: trit-emb (Phase 5a) + eff batch 64 (Phase 1 #7b). val 4.2016 vs g011 trit-emb eff=32 4.3731 = -0.172 nats. The eff=64 benefit is LARGER for trit-emb (-0.172) than for FP-emb (-0.106 from g005→g007), so the wins are super-additive. New Phase 5 champion at fixed compute. Gap to FP baseline (g007 4.0085) shrinks to +0.193 nats. Wall 16797s (2x eff=32). 98.5pct ternary recipe.","timestamp":1781812516,"segment":0}
{"run":14,"commit":"845e7a7","metric":4.3662,"metrics":{"loss_ema":4.0000,"flip_rate":6.170430e-05,"frac_zero_delta":-0.031612,"wall_seconds":8852,"val_step_500":6.5744,"val_step_1000":5.4834,"val_step_1500":5.1165,"val_step_2000":4.9638,"val_step_2500":4.7878,"val_step_3000":4.7209,"val_step_3500":4.5972,"val_step_4000":4.5198,"val_step_4500":4.4257,"val_step_5000":4.3662},"status":"discard","description":"Phase 3 #14: sandwich norm on trit-emb baseline. val 4.3662 vs g011 4.3731 = -0.007 nats (noise). Step 500 worse (6.57 vs 6.11): the extra norms disrupt very early training but converge to ~same. No measurable benefit at fast-A scale. Wall +4pct from extra norm compute. Discard.","timestamp":1781821544,"segment":0}
{"run":15,"commit":"9c47ab2","metric":4.0090,"metrics":{"loss_ema":3.6780,"flip_rate":1.071979e-04,"frac_zero_delta":-0.064090,"wall_seconds":33380,"val_step_500":5.9763,"val_step_1000":5.2172,"val_step_2000":4.7366,"val_step_5000":4.3452,"val_step_7000":4.2079,"val_step_8000":4.1309,"val_step_9000":4.0695,"val_step_10000":4.0090},"status":"keep","description":"Phase 5 ASYMPTOTE: trit-emb + unfrozen scales + share-kv + bf16 m + lr=0.15 + eff=64 + 10000 steps. val 4.0090. CLOSES THE GAP: 98.5pct ternary model at 10k steps matches g007 (FP-emb, eff=64, 5k steps) val 4.0085 within 0.0005 nats. Trajectory still descending at end (-0.019 last 500). Wall 33380s (~9h). The Phase 5 recipe is essentially as good as FP-emb at extended compute. NEW Phase 5 champion.","timestamp":1781855008,"segment":0}
{"run":16,"commit":"0db6c96","metric":3.8806,"metrics":{"loss_ema":3.5787,"flip_rate":3.012334e-04,"frac_zero_delta":-0.124627,"wall_seconds":30133,"val_step_500":5.3150,"val_step_1000":4.8356,"val_step_2000":4.4916,"val_step_5000":4.1583,"val_step_7000":4.0294,"val_step_8000":3.9622,"val_step_9000":3.9190,"val_step_10000":3.8806},"status":"keep","description":"FP-EMBEDDING CONTROL at extended compute: same recipe as g015 but FP embeddings instead of trit-embeddings. val 3.8806. CRITICAL COMPARISON: g015 trit-emb 10k eff=64 = 4.0090, gap = +0.128 nats (~3pct). This is the TRUE precision tax for 98.5pct ternary at 10k steps eff=64. Tax shrunk from 0.193 (at 5k) to 0.128 (at 10k); more compute would close further. Wall 30133s vs g015 33380s — trit-emb is 10pct slower due to QEmbedding overhead.","timestamp":1781885246,"segment":0}
{"run":17,"commit":"b4bc1bb","metric":5.0171,"metrics":{"step_at_interrupt":1800,"val_step_500":5.8944,"val_step_1000":5.3396,"val_step_1500":5.0171},"status":"discard","description":"trit-emb without --share-kv. INTERRUPTED at step 1800 (user SIGINT). Partial val at step 1500: 5.0171 vs g011 (with share-kv) 5.1603 = -0.143 nats — same pattern at 500 (-0.22) and 1000 (-0.21). Suggests share-kv MAY hurt the trit-emb regime; coarse ternary embeddings need more K/V degrees of freedom. Follow-up needed: full run + 10k extended check. Kept share-kv as baseline for now (marginal cost, real param savings).","timestamp":1781908224,"segment":0}
{"run":18,"commit":"0f0705a","metric":4.3803,"metrics":{"loss_ema":4.0136,"flip_rate":6.012709e-05,"frac_zero_delta":-0.026602,"wall_seconds":8295,"val_step_500":6.2228,"val_step_1000":5.6328,"val_step_1500":5.2073,"val_step_2000":5.0089,"val_step_2500":4.8176,"val_step_3000":4.7407,"val_step_3500":4.6074,"val_step_4000":4.5328,"val_step_4500":4.4391,"val_step_5000":4.3803},"status":"keep","description":"Phase 5d: scale_group_size 64 → 128. Halves scale count from 670K → 335K. val 4.3803 vs g011 (gs=64) 4.3731 = +0.007 nats (noise). FREE WIN: gs=128 adopted as new baseline. (gs=256 would require intermediate_size to be divisible by 256; 1408 isn't, so gs=128 is the practical max at fast-A.)","timestamp":1781916608,"segment":0}
{"run":19,"commit":"db975b4","metric":4.3313,"metrics":{"loss_ema":3.9660,"flip_rate":6.199299e-05,"frac_zero_delta":-0.030029,"wall_seconds":8507,"val_step_500":6.1590,"val_step_1000":5.4259,"val_step_1500":5.0529,"val_step_2000":4.9148,"val_step_2500":4.7509,"val_step_3000":4.6734,"val_step_3500":4.5610,"val_step_4000":4.4878,"val_step_4500":4.3943,"val_step_5000":4.3313},"status":"keep","description":"Confirms g017 partial: dropping --share-kv on trit-emb regime improves val. val 4.3313 vs g018 (with share-kv) 4.3803 = -0.049 nats. share-kv was the WRONG decision for trit-emb (the FP-emb decision didn't transfer). Coarser ternary embeddings need more K/V degrees of freedom. NEW baseline: trit-emb + gs=128 + no share-kv. Tradeoff: +1.6M trits (~+4pct trit count) for -0.05 nat val. Per user goal (minimize FP, not trits) drop share-kv.","timestamp":1781925176,"segment":0}
{"run":20,"commit":"0e77a5c","metric":4.2215,"metrics":{"loss_ema":3.9130,"flip_rate":6.964400e-05,"frac_zero_delta":-0.052135,"wall_seconds_resume_tail":6012,"val_step_500":5.9818,"val_step_1000":5.2284,"val_step_1500":4.9638,"val_step_2000":4.7175,"val_step_2500":4.5926,"val_step_3000":4.4837,"val_step_3500":4.3961,"val_step_4000":4.3240,"val_step_4500":4.2741,"val_step_5000":4.2215},"status":"keep","description":"COMPOUND: trit-emb + gs=128 + no share-kv + eff=64. val 4.2215. eff=64 benefit at no-share-kv baseline: g019 4.3313 → g020 4.2215 = -0.110 nats (close to g007 -0.106 at FP-emb). Interesting interaction: at eff=64, share-kv decision FLIPS: g020 (no share-kv) +0.020 vs g013 (with share-kv) 4.2016. Larger gradient denoising recovers the K/V degrees of freedom share-kv would have provided. Decision noise either way; keep no-share-kv default per user 'minimize FP not trits' priority. Hybrid run: bs=2 ga=32 for first 3334 steps, resumed twice with full opt state preserved.","timestamp":1781967290,"segment":0}
{"run":21,"commit":"2af9e7a","metric":3.9941,"metrics":{"loss_ema":3.6575,"flip_rate":1.116367e-04,"frac_zero_delta":-0.069035,"wall_seconds":34192,"val_step_500":6.1401,"val_step_1000":5.3204,"val_step_2000":4.7535,"val_step_5000":4.3285,"val_step_7000":4.1883,"val_step_8000":4.1178,"val_step_9000":4.0512,"val_step_10000":3.9941},"status":"keep","description":"Phase 5 ASYMPTOTE (no-share-kv baseline): trit-emb + gs=128 + no share-kv + eff=64 at 10k steps. val 3.9941 — BREAKS 4.0 floor on 98.5pct ternary model. vs g015 (with share-kv, 10k) 4.0090 = -0.015. Precision tax vs g016 FP-emb 3.8806 = +0.114 (~3pct). Trajectory still descending end (-0.024 last 500). interrupted.pt preserved.","timestamp":1781967290,"segment":0}
{"run":22,"commit":"ccced70","metric":4.4443,"metrics":{"loss_ema":4.0827,"flip_rate":7.472665e-05,"frac_zero_delta":-0.040734,"wall_seconds":8515,"val_step_500":6.0985,"val_step_1000":5.4862,"val_step_1500":5.1403,"val_step_2000":5.0063,"val_step_2500":4.8264,"val_step_3000":4.7361,"val_step_3500":4.6205,"val_step_4000":4.5552,"val_step_4500":4.4761,"val_step_5000":4.4443},"status":"discard","description":"Phase 5d: bf16 scales. val 4.4443 vs g019 (fp32 scales) 4.3313 = +0.113 nats. Real penalty, fails the +0.05 pass bar. bf16 storage truncates the Lion update's effective resolution (sign(m)*lr cast to bf16) and over many steps the EMA-derived parameter drifts. Discard; keep fp32 scales. fp16+stochastic-rounding would address this but requires implementing SR in Lion32.","timestamp":1782010212,"segment":0}
{"run":23,"commit":"c4a5375","metric":4.3290,"metrics":{"loss_ema":3.9527,"flip_rate":6.016914e-05,"frac_zero_delta":-0.030953,"wall_seconds":8633,"val_step_500":6.0519,"val_step_1000":5.4301,"val_step_1500":5.0406,"val_step_2000":4.9063,"val_step_2500":4.7354,"val_step_3000":4.6619,"val_step_3500":4.5574,"val_step_4000":4.4809,"val_step_4500":4.3870,"val_step_5000":4.3290},"status":"keep","description":"Drop --freeze-non-embed-fp. ~42K extra trainable params (norms, untied lm_head). val 4.3290 vs g019 4.3313 = -0.002 (noise). Free — adopt for simplicity (one fewer flag, less restrictive baseline).","timestamp":1782018903,"segment":0}
{"run":24,"commit":"e0a27cc","metric":4.6138,"metrics":{"loss_ema":4.2250,"flip_rate":7.903963e-06,"frac_zero_delta":-0.035644,"wall_seconds":8609,"val_step_500":6.3509,"val_step_1000":5.8253,"val_step_1500":5.4123,"val_step_2000":5.1909,"val_step_2500":5.0173,"val_step_3000":4.9142,"val_step_3500":4.8005,"val_step_4000":4.7306,"val_step_4500":4.6542,"val_step_5000":4.6138},"status":"discard","description":"Re-validate cautious-muon: --no-cautious-muon vs g023 (cautious on). val 4.6138 vs g023 4.3290 = +0.285 nats. BIG regression. Cautious mask is critical on GPT-trit-emb (even more than on HRM's +0.11). Keep cautious on.","timestamp":1782027572,"segment":0}
{"run":25,"commit":"c72f655","metric":4.3203,"metrics":{"loss_ema":3.9443,"flip_rate":5.800411e-05,"frac_zero_delta":-0.122107,"wall_seconds":8700,"val_step_500":6.0475,"val_step_1000":5.4026,"val_step_1500":5.0357,"val_step_2000":4.9037,"val_step_2500":4.7341,"val_step_3000":4.6529,"val_step_3500":4.5392,"val_step_4000":4.4636,"val_step_4500":4.3756,"val_step_5000":4.3203},"status":"keep","description":"Init zero-frac 0.50 → 0.67. val 4.3203 vs g023 (0.50) 4.3290 = -0.009 noise (slightly better). frac_zero_delta -0.12 vs g023 -0.03: model drops 4x more trits from initial than at 0.50. Adopt 0.67 — free win in the right direction.","timestamp":1782036329,"segment":0}
{"run":26,"commit":"0dc949a","metric":4.3545,"metrics":{"loss_ema":3.9788,"flip_rate":6.156089e-05,"frac_zero_delta":0.059425,"wall_seconds":8815,"val_step_500":6.2442,"val_step_1000":5.5179,"val_step_1500":5.0939,"val_step_2000":4.9508,"val_step_2500":4.7746,"val_step_3000":4.6884,"val_step_3500":4.5814,"val_step_4000":4.5000,"val_step_4500":4.4080,"val_step_5000":4.3545},"status":"discard","description":"Init zero-frac 0.33. val 4.3545 vs g025 (0.67) 4.3203 = +0.034. Sweep ordering: 0.67 < 0.50 < 0.33 (monotone, higher zerofrac wins). frac_zero_delta = +0.059 (only positive in our runs): at 0.33 init the model gains zeros (sparsifies), at 0.67 it loses (densifies). Convergence target ~40-50pct zero. Try one more leg at 0.80.","timestamp":1782045196,"segment":0}
