{"run":27,"commit":"c91aefa","metric":4.3023,"metrics":{"loss_ema":3.9326,"flip_rate":5.488933e-05,"frac_zero_delta":-0.193077,"wall_seconds":8758,"val_step_500":6.0858,"val_step_1000":5.3579,"val_step_1500":4.9967,"val_step_2000":4.8852,"val_step_2500":4.7166,"val_step_3000":4.6411,"val_step_3500":4.5250,"val_step_4000":4.4529,"val_step_4500":4.3560,"val_step_5000":4.3023},"status":"keep","description":"Init zero-frac 0.80. val 4.3023 — extends monotone trend (0.33→4.35, 0.50→4.33, 0.67→4.32, 0.80→4.30). frac_zero_delta -0.193 (relaxes 80→61pct zero). Adopt 0.80. Bracket at 0.90 next.","timestamp":1782054013,"segment":0}
{"run":28,"commit":"4776889","metric":4.2840,"metrics":{"loss_ema":3.9140,"flip_rate":5.273510e-05,"frac_zero_delta":-0.250916,"wall_seconds":8696,"val_step_500":6.2728,"val_step_1000":5.3345,"val_step_1500":4.9732,"val_step_2000":4.8665,"val_step_2500":4.6962,"val_step_3000":4.6230,"val_step_3500":4.5172,"val_step_4000":4.4447,"val_step_4500":4.3403,"val_step_5000":4.2840},"status":"keep","description":"Init zero-frac 0.90. val 4.2840 — still descending the sweep monotonically. Sweep: 0.33→4.35, 0.50→4.33, 0.67→4.32, 0.80→4.30, 0.90→4.28. frac_zero_delta -0.251 (relaxes 90→65pct zero). New best. Bracket at 0.95 next.","timestamp":1782062763,"segment":0}
{"run":29,"commit":"c901081","metric":4.3065,"metrics":{"loss_ema":3.9271,"flip_rate":4.032551e-05,"frac_zero_delta":-0.336458,"wall_seconds":7750,"val_step_500":6.1700,"val_step_1000":5.3855,"val_step_1500":4.9852,"val_step_2000":4.8638,"val_step_2500":4.6908,"val_step_3000":4.6206,"val_step_3500":4.5197,"val_step_4000":4.4523,"val_step_4500":4.3533,"val_step_5000":4.3065},"status":"discard","description":"Init zero-frac 0.95. val 4.3065 vs g028 (0.90) 4.2840 = +0.023 (worse). 0.95 past optimum. BRACKETED: final sweep 0.33→4.35, 0.50→4.33, 0.67→4.32, 0.80→4.30, 0.90→4.28*, 0.95→4.31. Lock 0.90 as new baseline. Total init contribution: -0.045 nats from default 0.50.","timestamp":1782079376,"segment":0}
{"run":30,"commit":"fbd37fc","metric":3.9321,"metrics":{"loss_ema":3.5961,"flip_rate":1.067899e-04,"frac_zero_delta":-0.326164,"wall_seconds":34254,"val_step_500":5.9767,"val_step_1000":5.0840,"val_step_2000":4.6295,"val_step_5000":4.2384,"val_step_7000":4.1098,"val_step_8000":4.0512,"val_step_9000":3.9919,"val_step_10000":3.9321},"status":"keep","description":"Phase 5 NEW ASYMPTOTE: all proven wins compounded at 10k steps eff=64. val 3.9321 — new champion. vs g021 (prev best 10k) 3.9941 = -0.062 nats. Precision tax to FP-emb baseline (g016 3.8806) = +0.052 nats (~1.3pct). Trajectory still descending at step 10000 (-0.015 last 500). 98.5pct ternary recipe matches FP at this scale within 5cents.","timestamp":1782113690,"segment":0}
{"run":"30-ext","commit":"ec86977","metric":3.8907,"metrics":{"loss_ema":3.4287,"flip_rate":9.885895e-05,"frac_zero_delta":-0.383152,"wall_seconds_resume_tail":10557,"val_step_10000":3.9321,"val_step_10500_postspike":4.1835,"val_step_13500":4.0952,"val_step_17500":3.9553,"val_step_20000":3.8907},"status":"keep","description":"g030 EXTENSION to 20k via the broken pre-fix resume path. val 3.8907 — matches g016 FP-emb 10k (3.8806) within 0.010 nats, with 98.5pct of weights ternary. BUT contaminated by LR-spike at step 10000 (cosine reshape from 10k→20k schedule made LR jump 30x): val bounced from 3.93 to 4.18, took ~3k steps to recover, ~10k effective steps lost. The clean Phase 5 asymptote (g030 first 10k = 3.9321) was actually our best signal. Without the spike, step 20000 would likely be ~3.85. lr-snapshot fix is in place for future extensions.","timestamp":1782159337,"segment":0}
{"run":32,"commit":"688d911","metric":6.5627,"metrics":{"loss_ema":6.3819,"flip_rate":1.222323e-05,"frac_zero_delta":-0.187698,"wall_seconds":8411,"val_step_500":7.1195,"val_step_1000":7.1673,"val_step_1500":7.1030,"val_step_2000":7.0488,"val_step_2500":6.8997,"val_step_3000":6.8267,"val_step_3500":6.7117,"val_step_4000":6.6374,"val_step_4500":6.5791,"val_step_5000":6.5627},"status":"discard","description":"BitNet-style per-tensor absmean γ = mean(|w|). val 6.5627 vs g023 4.3290 = +2.23 nats (catastrophic). Failure mode: a single shared γ per tensor can't track per-row magnitude differences, especially under our 0.90 init (sparse trits). Loss went UP step 500→1000 before slow descent. Per-tensor granularity insufficient at this scale. Try per-row computed γ next.","timestamp":1782171627,"segment":0}
{"run":33,"commit":"aa5083c","metric":6.9575,"metrics":{"loss_ema":6.8370,"flip_rate":1.330440e-05,"frac_zero_delta":-0.139034,"wall_seconds":8413,"val_step_500":8.4781,"val_step_1000":7.5457,"val_step_1500":7.3144,"val_step_2000":7.3007,"val_step_2500":7.2988,"val_step_3000":7.3468,"val_step_3500":7.1913,"val_step_4000":7.2072,"val_step_4500":7.0061,"val_step_5000":6.9575},"status":"discard","description":"Per-row COMPUTED γ. val 6.9575 vs g023 4.3290 = +2.63 nats (even worse than g032 per-tensor). Failure mode: detached γ on absmean creates scale-invariance — q_ternary*γ is invariant to coordinated latent rescaling, so the gradient signal can't push toward useful magnitudes. BitNet works because their absmean is wrapped in a learnable γ; pure-computed kills the magnitude gradient flow under STE. Conclusion: scales must be learnable. Try per-row LEARNABLE scales next (g034 with --scale-group-size 0 = per-row, ~50K vs g023's 350K, 7x reduction).","timestamp":1782180200,"segment":0}
{"run":34,"commit":"b60aa84","metric":4.4600,"metrics":{"loss_ema":4.0785,"flip_rate":7.660002e-05,"frac_zero_delta":-0.207949,"wall_seconds":8686,"val_step_500":6.4154,"val_step_1000":5.8198,"val_step_1500":5.3704,"val_step_2000":5.2232,"val_step_2500":4.9500,"val_step_3000":4.8336,"val_step_3500":4.6985,"val_step_4000":4.6207,"val_step_4500":4.5152,"val_step_5000":4.4600},"status":"discard","description":"Per-row learnable scales (--scale-group-size 0): 81K scales vs g023 gs=128's 350K (4.3x reduction). val 4.4600 vs g023 4.3290 = +0.131 nats (+3pct). Fails the 'maintain quality' bar (+0.05 tolerance). Keep gs=128 as baseline. The scale storage isn't the right knob — per-(row,group) at gs=128 captures real structure that per-row alone misses. Memory minimization on scales is essentially capped here.","timestamp":1782189033,"segment":0}
{"run":35,"commit":"071b0b7","metric":4.3632,"metrics":{"loss_ema":3.9952,"flip_rate":3.920564e-05,"frac_zero_delta":-0.204543,"wall_seconds":8291,"val_step_500":6.4853,"val_step_1000":5.7593,"val_step_1500":5.1640,"val_step_2000":4.9838,"val_step_2500":4.7813,"val_step_3000":4.6982,"val_step_3500":4.5925,"val_step_4000":4.5143,"val_step_4500":4.4151,"val_step_5000":4.3632},"status":"discard","description":"CMuon ns_steps 5→3 (40pct fewer NS FLOPs). val 4.3632 vs g023 4.3290 = +0.034 nats (under 1pct). Wall 8291s vs 8633s = -342s (-4pct). Marginal pass — small wall win at slight quality cost. Per-layer NS schedule (Muon-spectra paper) would be the proper version: more NS on embed (49152×512), less on attn (512×512). Queue: bracket with ns=4 first (g036), then per-layer schedule.","timestamp":1782197394,"segment":0}
{"run":36,"commit":"535e683","metric":4.2824,"metrics":{"loss_ema":3.9156,"flip_rate":5.760620e-05,"frac_zero_delta":-0.243424,"wall_seconds":8472,"val_step_500":6.1137,"val_step_1000":5.3481,"val_step_1500":5.0057,"val_step_2000":4.8674,"val_step_2500":4.7045,"val_step_3000":4.6290,"val_step_3500":4.5211,"val_step_4000":4.4496,"val_step_4500":4.3386,"val_step_5000":4.2824},"status":"keep","description":"NS=4: val 4.2824 vs g023 (NS=5) 4.3290 = -0.047 nats (NEW BEST). Wall -2pct. NS=5 over-orthogonalizes; NS=4 is the sweet spot. Free quality + wall win. Adopt NS=4 baseline. Sweep ordering: NS=3 4.3632 > NS=5 4.3290 > NS=4 4.2824.","timestamp":1782205942,"segment":0}
{"run":37,"commit":"f561884","metric":4.6477,"metrics":{"loss_ema":4.2972,"flip_rate":7.622193e-06,"frac_zero_delta":-0.111514,"wall_seconds":9169,"val_step_500":6.6761,"val_step_1000":6.2151,"val_step_1500":5.7023,"val_step_2000":5.3281,"val_step_2500":5.0611,"val_step_3000":4.9481,"val_step_3500":4.8453,"val_step_4000":4.7695,"val_step_4500":4.6831,"val_step_5000":4.6477},"status":"discard","description":"NS=2 (final NS sweep leg): val 4.6477 vs g036 NS=4 4.2824 = +0.365 nats catastrophic, also wall +697s (unexpectedly slower — likely cosine-LR feedback from undertrained late epochs). NS=4 confirmed as the optimum. Final NS sweep: NS=2 4.65 / NS=3 4.36 / NS=4 4.28* / NS=5 4.33.","timestamp":1782215184,"segment":0}
{"run":38,"commit":"a534673","metric":null,"metrics":{"oom_at_step":0,"reason":"OOM at bs=8 ga=4 (1.5GiB needed, 1.4GiB free)"},"status":"discard","description":"bs=8 ga=4 OOM at step 0. Activation memory ceiling at bs=4 on the 6GB card. Skip throughput dial — bs sweep exhausted at 4. Move to per-layer NS schedule (g039).","timestamp":1782215408,"segment":0}
{"run":39,"commit":"2281902","metric":4.3094,"metrics":{"loss_ema":3.9446,"flip_rate":3.149702e-05,"frac_zero_delta":-0.209127,"wall_seconds":9134,"val_step_500":6.0204,"val_step_1000":5.4348,"val_step_1500":5.0005,"val_step_2000":4.8696,"val_step_2500":4.7034,"val_step_3000":4.6357,"val_step_3500":4.5230,"val_step_4000":4.4532,"val_step_4500":4.3625,"val_step_5000":4.3094},"status":"discard","description":"Per-layer NS schedule (ns=2 attn / ns=3 mlp / ns=6 embed). val 4.3094 vs g036 (NS=4 global) 4.2824 = +0.027 nats. Wall 9134s vs 8472s = +8pct SLOWER. Big embed at ns=6 dominates wall cost, attn ns=2 too aggressive. Per-layer schedule doesn't help at our scale because (a) NS=4 was already optimum globally, (b) NS quality is monotone non-linear in shape — embed wants more but the cost dominates. Stay with NS=4 global. Could revisit per-layer with different heuristic later.","timestamp":1782229103,"segment":0}
{"run":40,"commit":"879b5ec","metric":4.3029,"metrics":{"loss_ema":3.9377,"flip_rate":7.272006e-06,"frac_zero_delta":-0.287003,"wall_seconds_total":8772,"wall_seconds_pre":2987,"wall_seconds_post":5785,"val_step_500":6.1786,"val_step_1000":5.5690,"val_step_1500":5.1119,"val_step_2000":4.9503,"val_step_2500":4.7733,"val_step_3000":4.6869,"val_step_3500":4.5735,"val_step_4000":4.4879,"val_step_4500":4.3802,"val_step_5000":4.3029},"status":"discard","description":"Per-layer NS cap=4 (ns=2/24 attn, ns=3/18 mlp, ns=4/1 embed). val 4.3029 vs g036 NS=4 global 4.2824 = +0.020. Total wall 8772s vs 8472s = +3.5pct SLOWER even with corrected schedule. Lesson: kernel-launch overhead on small attn matrices at ns=2 dominates the actual FLOP savings (low arithmetic intensity). Per-layer NS not viable at our scale. Stay with NS=4 global. Resume after SIGINT was clean — lr-snapshot fix worked: Lion re-anchored 3.91e-4, CMuon 1.09e-1 over 3229 remaining steps.","timestamp":1782253651,"segment":0}
{"run":41,"commit":"33be7d0","metric":3.9096,"metrics":{"loss_ema":3.5999,"flip_rate":6.678938e-05,"frac_zero_delta":-0.400557,"wall_seconds":31631,"val_step_500":5.8424,"val_step_1000":5.1087,"val_step_2000":4.6237,"val_step_5000":4.2198,"val_step_7000":4.0879,"val_step_8000":4.0208,"val_step_9000":3.9622,"val_step_10000":3.9096},"status":"keep","description":"ALL-WINS CHAMPION at 10k: trit-emb + gs=128 + no share-kv + trainable norms + init=0.90 + NS=4 + eff=64 + bf16 m. val 3.9096 — NEW TERNARY CHAMPION at 98.5pct ternary. vs g030 (same recipe minus NS=4) 10k = 3.9321 → -0.023. vs FP-emb baseline g016 10k 3.8806 → +0.029 nats precision tax. Trajectory still descending end (-0.018 last 500). Wall 31631s vs g030 33380s = -5pct (NS=4 saves wall). Hybrid bs=2 ga=32 first 141 steps, bs=4 ga=16 rest (LR re-anchored via lr-snapshot fix, no spike). New SOTA for our recipe.","timestamp":1782286021,"segment":0}
{"run":41,"commit":"54df4c3","metric":3.9096,"metrics":{"loss_ema":3.5999,"flip_rate":6.678938e-05,"wall_seconds":31631,"val_step_5000":4.2198,"val_step_10000":3.9096},"status":"keep","description":"ALL-WINS CHAMPION at 10k: trit-emb + gs=128 + no share-kv + trainable norms + init=0.90 + NS=4 + eff=64 + bf16 m. val 3.9096 — NEW TERNARY CHAMPION at 98.5pct ternary. Extension to 20k attempted but LR-spike contaminated (interrupted.pt at step 10000 lacked lr_snapshot because end-of-run save path was missing the lr_snapshot kwarg; fix committed 54df4c3). Extension killed; clean 10k result stands. 5k→10k NS=4 advantage diminishes (-0.047 → -0.023), expected to shrink further at 20k.","timestamp":1782287000,"segment":0}
{"run":42,"commit":"e58a952","metric":4.1487,"metrics":{"loss_ema":3.8823,"flip_rate":9.528823e-05,"wall_seconds":14009,"val_step_500":5.8156,"val_step_1000":5.0884,"val_step_1500":4.7931,"val_step_2000":4.6248,"val_step_2500":4.5126,"val_step_3000":4.4053,"val_step_3500":4.3372,"val_step_4000":4.2728,"val_step_4500":4.1953,"val_step_5000":4.1487},"status":"keep","description":"X-former ⊗ profile [512,384,256,256,384,512] at 5k eff=64. val 4.1487 vs g041 first 5k (flat, eff=64) 4.2198 = -0.071 nats. -13pct params (39.0M vs 44.8M). Wall 14009s = ~12pct less per step than g041's flat-width ~3163s/1k. All three axes win: quality + memory + wall. Extending via interrupted.pt resume to 10k.","timestamp":1782347349,"segment":0}
{"run":43,"commit":"8defa8b","metric":3.9690,"metrics":{"loss_ema":3.6704,"flip_rate":1.223752e-04,"frac_zero_delta":-0.288494,"wall_seconds":27841,"val_step_500":5.9016,"val_step_1000":5.0610,"val_step_2000":4.6354,"val_step_5000":4.2813,"val_step_7000":4.1736,"val_step_8000":4.1112,"val_step_9000":4.0396,"val_step_10000":3.9690},"status":"keep","description":"X-former ⊗ [512,384,256,256,384,512] fresh 10k. val 3.9690 vs g041 flat 10k 3.9096 = +0.060 per step. BUT wall 27841s vs 31631s = -12pct. At equal wall (27841s) g041 would be at step ~8800 with val ~4.00 → X-former wins per WALL TIME by ~0.03 nats AND saves 13pct params (39.0M vs 44.7M). Narrow middle saturates earlier than wide (5k advantage -0.071 shrunk to -0.03 at 10k equal-wall), but the savings net out positive for the user's fastest-wall-clock goal.","timestamp":1782375398,"segment":0}
{"run":44,"commit":"39a0799","metric":3.9392,"metrics":{"loss_ema":3.6368,"flip_rate":1.164023e-04,"frac_zero_delta":-0.307307,"wall_seconds":30649,"val_step_5000":4.2530,"val_step_10000":3.9392},"status":"keep","description":"X-former gentle ⊗ [512,512,384,384,512,512] (42.8M) 10k. val 3.9392 vs g041 flat 3.9096 = +0.03 per step. Wall 30649 vs 31631 = -3pct. At equal wall g041 ≈ 3.92, so g044 LOSES per-wall by 0.02. Gentle narrowing didn't save enough wall to offset quality drop. g043 (more aggressive narrow) remains the better X-former variant per wall.","timestamp":1782406215,"segment":0}
{"run":45,"commit":"9ffea6d","metric":4.2390,"metrics":{"loss_ema":3.8578,"flip_rate":5.457849e-05,"frac_zero_delta":-0.262311,"wall_seconds":9676,"val_step_500":6.1930,"val_step_5000":4.2390},"status":"keep","description":"8L flat gs=128 scale-up baseline 5k. val 4.2390 vs g036 6L same recipe 4.2824 = -0.043 nats from 2 extra layers. Wall 9676s vs g036 8472s = +14pct (8/6=1.33 expected). 51.3M params. Baseline for g046 per-row-at-scale comparison.","timestamp":1782416018,"segment":0}
{"run":46,"commit":"c56401f","metric":4.3821,"metrics":{"loss_ema":3.9955,"flip_rate":7.464379e-05,"frac_zero_delta":-0.211045,"wall_seconds":9721,"val_step_500":6.3708,"val_step_5000":4.3821},"status":"discard","description":"8L per-row gs=0 5k. val 4.3821 vs g045 8L gs=128 4.2390 = +0.143 nats. Compare to 6L per-row gap (+0.131): scale-up did NOT shrink the per-row penalty (slightly grew). Both granularities benefit ~equally from depth. Per-row closed as a memory lever; gs=128 stays.","timestamp":1782425829,"segment":0}
{"run":47,"commit":"cb7a1b1","metric":3.8482,"metrics":{"loss_ema":3.5419,"flip_rate":7.865355e-10,"frac_zero_delta":-0.335099,"wall_seconds_tail":1374,"val_step_5000":4.1962,"val_step_10000":3.8482},"status":"keep","description":"NEW ALL-TIME TERNARY CHAMPION: 8L flat gs=128 + locked recipe (trit-emb + no share-kv + init=0.90 + NS=4 + bf16 m + eff=64) at 10k. val 3.8482 — beats g041 (44.7M, 6L) 3.9096 by -0.061, beats FP-emb g016 3.8806 by -0.032 at 98.5pct ternary. 51.3M params, ~33pct more than 6L. Scale-up confirms recipe transfers; small-scale optimization pays off at larger scale.","timestamp":1782477445,"segment":0}
{"run":48,"commit":"7824d1a","metric":3.7272,"metrics":{"loss_ema":3.2977,"flip_rate":0.0,"frac_zero_delta":-0.380936,"wall_seconds_tail":11486,"val_step_10000":4.0855,"val_step_15000":3.9294,"val_step_20000":3.7272},"status":"keep","description":"NEW ALL-TIME CHAMPION: 8L flat 20k fresh. val 3.7272. Beats g047 (10k) by -0.121, beats FP-emb baseline (g016 6L 10k) by -0.153 at 98.5pct ternary. Trajectory still descending (-0.007 last 500). Recipe officially locked: trit-emb + gs=128 + no share-kv + trainable norms + init=0.90 + NS=4 + bf16 m + eff=64 + 8L flat + clean cosine.","timestamp":1782564961,"segment":0}
{"run":49,"commit":"68dafae","metric":3.9884,"metrics":{"loss_ema":3.7071,"flip_rate":2.103327e-05,"frac_zero_delta":-0.398759,"wall_seconds":16880,"val_step_500":5.9493,"val_step_1000":5.0100,"val_step_1500":4.7262,"val_step_2000":4.5508,"val_step_2500":4.4419,"val_step_3000":4.3099,"val_step_3500":4.2062,"val_step_4000":4.1206,"val_step_4500":4.0365,"val_step_5000":3.9884},"status":"keep","description":"12L flat gs=128 5k. val 3.9884 — NEW BEST 5k checkpoint at sub-4.0. Beats 8L 5k (g045) 4.2390 by -0.25 nats, vs predicted -0.04 (depth scaling NOT plateaued). 64.2M params. Wall 16880s includes SIGINT cycle (re-resume clean via lr_snapshot at step 1381). Trajectory still descending end (-0.05 last 500). 12L 10k extrapolates to ~3.7-3.75 territory (matches 8L 20k g048 3.7272 at HALF the steps). Queue g050 12L flat 10k fresh."}
{"run":50,"commit":"c0c335a","metric":3.7674,"metrics":{"loss_ema":3.4497,"flip_rate":0.0,"frac_zero_delta":-0.363446,"wall_seconds_tail":7727,"val_step_500":5.9097,"val_step_1000":4.9832,"val_step_1500":4.7138,"val_step_2000":4.5387,"val_step_2500":4.4507,"val_step_3000":4.3669,"val_step_3500":4.2944,"val_step_4000":4.2291,"val_step_4500":4.1746,"val_step_5000":4.1221,"val_step_5500":4.0980,"val_step_6000":4.0534,"val_step_6500":4.0390,"val_step_7000":3.9865,"val_step_7500":3.9537,"val_step_8000":3.9144,"val_step_8500":3.8787,"val_step_9000":3.8546,"val_step_9500":3.7922,"val_step_10000":3.7674},"status":"keep","description":"12L flat gs=128 10k. val 3.7674. Champion g048 (8L 20k 3.7272) HOLDS by -0.04 AND wins per wall (~9h vs g050's ~14h combined including driver crash recovery). 12L is ~3x slower per step than 8L (5s/step vs 1.6s/step) — quality gain doesn't recover the wall cost at this step budget. cudaErrorLaunchFailure crash at step 8500+ (transient driver state, recovered via sudo modprobe), resumed clean via lr_snapshot (interrupted.pt periodic save was at exactly step 8500). Conclusion: 12L not productive per-wall at 10k. Pivoting to extend champion's 8L recipe further (8L 30k fresh)."}
{"run":51,"commit":"467d1da","metric":3.7030,"metrics":{"loss_ema":3.4008,"flip_rate":1.507561e-04,"frac_zero_delta":-0.402803,"wall_seconds":138425,"val_step_500":5.9094,"val_step_1000":5.0500,"val_step_5000":4.2897,"val_step_10000":4.1256,"val_step_15000":4.0342,"val_step_20000":3.9294,"val_step_25000":3.8180,"val_step_28500":3.7263,"val_step_30000":3.7030},"status":"keep","description":"NEW ALL-TIME CHAMPION 3.7030 at step 30k. Beats g048 (8L 20k 3.7272) by -0.024 nats. BUT wall 138425s (38.5h) vs g048 32000s (8.9h) = 4.3x more wall for marginal gain. 30k cosine spends LR slowly: at step 20k g051 hit 3.9294 = exactly where g048 was at step 15k (wasted 5k steps in the long-horizon LR schedule). Sweet spot per-wall is mid-range 20-25k, not 30k. Tail-end floor-LR fine-tune (steps 28k-30k) was where most of the win materialized. 51.3M params. Recipe unchanged from g048 except total-steps=30k."}
{"run":52,"commit":"3e764f4","metric":4.1409,"metrics":{"loss_ema":3.8669,"flip_rate":0.0,"frac_zero_delta":-0.266559,"wall_seconds_tail":13776,"val_step_500":6.0871,"val_step_1000":5.3124,"val_step_1500":4.8822,"val_step_2000":4.6922,"val_step_2500":4.5650,"val_step_3000":4.4327,"val_step_3500":4.3248,"val_step_4000":4.2213,"val_step_4500":4.1494,"val_step_5000":4.1409},"status":"keep","description":"P5b WIN: bf16 latents BEAT fp16 by -0.098 nats. val 4.1409 vs g045 fp16-latents baseline 4.2390. Surprise: bf16's wider exponent range (8-bit) protects small gradient updates from underflow during STE, while reduced mantissa (7 vs fp16's 11) is plenty for trit-latent magnitude tracking ({-1,0,+1} target). Note: trainer killed at step 1625 (no traceback), resumed clean from interrupted.pt at step 1500 via lr_snapshot. Quality result trustworthy — descent through resume was smooth. Adopt bf16 latents as new default. Queue g053 = bf16 latents + bf16 scales (P5c.1 Lion sign-robustness probe)."}
