{"type":"config","name":"ternary-hrm-fast-recipe","metricName":"val_loss","metricUnit":"nats","bestDirection":"lower"}
{"run":1,"commit":"64dfda5","metric":6.9074,"metrics":{"loss_ema":6.8269,"flip_rate":3.858971e-6,"frac_zero_delta":-0.011147,"per_loop_gap":0.039062,"wall_seconds":19189},"status":"keep","description":"baseline hrm-G replay: lognormal frozen scales + frozen non-embed FP, Lion-on-embed, Bop Bet1 tau_norm=0.15","timestamp":1780583203,"segment":0}
{"run":2,"commit":"1c018e7","metric":6.8893,"metrics":{"loss_ema":6.8183,"flip_rate":4.073227e-6,"frac_zero_delta":-0.010856,"per_loop_gap":0.0652,"wall_seconds":21109},"status":"keep","description":"cautious mask on BopTernary (sign(m)==sign(g_t)); rest = baseline","timestamp":1780604663,"segment":0}
{"run":3,"commit":"4e87cd6","metric":6.5320,"metrics":{"loss_ema":6.4223,"flip_rate":2.630872e-4,"frac_zero_delta":-0.019360,"per_loop_gap":0.0321,"wall_seconds":20333},"status":"keep","description":"CMuon (Newton-Schulz5 orthogonalized momentum + cautious mask) on STE'd ternary latents; non-trit FP via Lion; rest = baseline structure","timestamp":1780638748,"segment":0}
{"type":"config","name":"ternary-hrm-screening","metricName":"val_loss","metricUnit":"nats","bestDirection":"lower"}
{"run":4,"commit":"4e87cd6","metric":5.4674,"metrics":{"loss_ema":5.2768,"flip_rate":1.710115e-5,"frac_zero_delta":-0.045751,"wall_seconds":1927},"status":"keep","description":"SCREENING s1: Bop+cautious on tiny non-loop (26M, H=L=2, cycles=1x1, 1500 steps)","timestamp":1780652178,"segment":1}
{"run":5,"commit":"4e87cd6","metric":5.1850,"metrics":{"loss_ema":4.9728,"flip_rate":3.937841e-4,"frac_zero_delta":-0.003598,"wall_seconds":1946},"status":"keep","description":"SCREENING s2: CMuon STE on tiny non-loop (vs s1=5.4674, -0.28)","timestamp":1780660274,"segment":1}
{"run":6,"commit":"4e87cd6","metric":5.5221,"metrics":{"loss_ema":5.3654,"flip_rate":2.638188e-4,"frac_zero_delta":-0.006351,"wall_seconds":1679},"status":"discard","description":"SCREENING s3: Lion-STE on tiny non-loop (5.5221, worse than s2 CMuon 5.1850 and s1 Bop+cautious 5.4674)","timestamp":1780667035,"segment":1}
{"run":7,"commit":"c553358","metric":5.1848,"metrics":{"loss_ema":4.9737,"flip_rate":3.946262e-4,"frac_zero_delta":-0.003444,"wall_seconds":1930},"status":"keep","description":"SCREENING s4: CMuon-STE + int8 per-token-absmax activations. val 5.1848 vs s2 5.1850 (noise-level, int8 act is free)","timestamp":1780669110,"segment":1}
{"run":8,"commit":"c553358","metric":5.1962,"metrics":{"loss_ema":4.9861,"flip_rate":3.942758e-4,"frac_zero_delta":-0.004012,"wall_seconds":1869},"status":"discard","description":"SCREENING s5: CMuon-STE + fp16 m state. val 5.1962 vs s2 5.1850 (+0.011). Small but real penalty; revisit if memory pressure on main run.","timestamp":1780673191,"segment":1}
{"type":"config","name":"ternary-hrm-fast-recipe","metricName":"val_loss","metricUnit":"nats","bestDirection":"lower"}
{"run":9,"commit":"c553358","metric":7.1094,"metrics":{"step_at_interrupt":475,"sec_per_step":12.19,"loss_ema_at_interrupt":7.1094},"status":"discard","description":"MAIN HRM 153M + CMuon-STE + int8 act, INTERRUPTED by user at step 475. int8 act tax was +50% wall time on main (12.2 s/step vs Run 3's 8.1) — not worth it for fastest-recipe metric. Discard.","timestamp":1780692232,"segment":0}
{"run":10,"commit":"c553358","metric":6.5510,"metrics":{"loss_ema":6.4606,"flip_rate":2.676547e-4,"frac_zero_delta":-0.040469,"per_loop_gap":0.0828,"wall_seconds":4270},"status":"keep","description":"FAST-A baseline: 38M HRM (hidden=512, H=L=2, cycles=2x3), CMuon-STE. val 6.5510 (vs Run 3 full 153M 6.5320, only +0.019). Validates fast-A as iteration surrogate.","timestamp":1780724159,"segment":0}
{"run":11,"commit":"c553358","metric":6.5714,"metrics":{"val_step_500":6.2078,"val_step_1000":6.2976,"val_step_1500":6.4735,"val_step_2000":6.5762,"loss_ema":6.4869,"flip_rate":2.767072e-4,"frac_zero_delta":-0.129554,"per_loop_gap":0.0999,"wall_seconds":3606},"status":"discard","description":"FAST-A + full BPTT first 500 steps then 1-step. FINAL val 6.5714 > baseline 6.5510 (discard by metric) BUT val at end of full-BPTT phase (step 500) was 6.2078 — drastically better. The 1-step phase visibly DEGRADED the model. Suggests full BPTT throughout will dominate.","timestamp":1780851372,"segment":0}
{"run":12,"commit":"c553358","metric":4.9572,"metrics":{"loss_ema":4.6984,"flip_rate":3.523690e-4,"frac_zero_delta":-0.011888,"per_loop_gap":0.0367,"wall_seconds":6508},"status":"keep","description":"FAST-A + FULL BPTT throughout 2500 steps. val 4.9572 — improvement of -1.59 vs Run 10 (6.5510). The 1-step gradient approximation was THE bottleneck on HRM training in our setup. New champion by a huge margin.","timestamp":1780858065,"segment":0}
{"run":13,"commit":"ea2d2cb","metric":4.7779,"metrics":{"loss_ema":4.5447,"flip_rate":1.249659e-4,"frac_zero_delta":-0.006481,"per_loop_gap":0.0156,"wall_seconds":33408,"val_step_500":6.0836,"val_step_1000":5.4221,"val_step_1500":5.1301,"val_step_2000":4.9607},"status":"keep","description":"MAIN 153M HRM + CMuon-STE + full BPTT throughout, bs=1 ga=32. val 4.7779 — new champion, -1.75 vs Run 3 (prior 153M champion), -2.13 vs baseline Run 1. Confirms full BPTT recipe scales from 38M to 153M.","timestamp":1780896195,"segment":0}
{"run":14,"commit":"ea2d2cb","metric":5.0628,"metrics":{"loss_ema":4.8162,"flip_rate":2.715099e-4,"frac_zero_delta":-0.009604,"per_loop_gap":0.0168,"wall_seconds":6537},"status":"discard","description":"FAST-A + full BPTT + NON-cautious CMuon. val 5.0628 vs Run 12's 4.9572 (+0.11). Cautious mask IS helping at 90% zeroing rate on HRM; keep cautious=True.","timestamp":1780909605,"segment":0}
{"run":15,"commit":"ea2d2cb","metric":5.1950,"metrics":{"loss_ema":4.9514,"flip_rate":1.325023e-4,"frac_zero_delta":-0.003877,"per_loop_gap":0.0376,"wall_seconds":6621},"status":"discard","description":"FAST-A + full BPTT + CMuon lr=0.01 (half). val 5.1950 vs Run 12's 4.9572 (+0.24). Lower LR hurts. Try higher.","timestamp":1780917606,"segment":0}
{"run":16,"commit":"ea2d2cb","metric":4.5923,"metrics":{"loss_ema":4.3500,"flip_rate":1.030432e-3,"frac_zero_delta":-0.036751,"per_loop_gap":0.0398,"wall_seconds":6736},"status":"keep","description":"FAST-A + full BPTT + CMuon lr=0.05 (2.5x Run 12's 0.02). val 4.5923 — new best, beats Run 13 (153M lr=0.02) at 4.78! Higher LR is the right direction.","timestamp":1780926433,"segment":0}
{"run":17,"commit":"ea2d2cb","metric":5.9628,"metrics":{"loss_ema":5.6627,"flip_rate":7.678192e-4,"frac_zero_delta":-0.030956,"per_loop_gap":0.2547,"wall_seconds":4328,"step_at_interrupt":2050},"status":"discard","description":"FAST-A + last-per-cycle grad-mode + lr=0.05. Interrupted at step 2050 but val trajectory was clearly losing decisively to Run 16's full BPTT (5.96 vs 4.59). Last-per-cycle gives ~20% wall savings but huge quality cost.","timestamp":1780939283,"segment":0}
{"run":18,"commit":"ea2d2cb","metric":4.5001,"metrics":{"loss_ema":4.2680,"flip_rate":1.815824e-3,"frac_zero_delta":-0.074260,"per_loop_gap":0.0768,"wall_seconds":6544},"status":"keep","description":"FAST-A + full BPTT + CMuon lr=0.10 (2x Run 16's 0.05). val 4.5001 — new champion, -0.09 vs Run 16. LR sweep diminishing returns visible.","timestamp":1780946020,"segment":0}
{"run":19,"commit":"ea2d2cb","metric":4.5808,"metrics":{"loss_ema":4.3409,"flip_rate":2.981125e-3,"frac_zero_delta":-0.111326,"per_loop_gap":0.0496,"wall_seconds":6557},"status":"discard","description":"FAST-A + full BPTT + CMuon lr=0.20. val 4.5808 (+0.08 vs Run 18's 4.50). LR peak found at 0.10.","timestamp":1780954213,"segment":0}
{"run":20,"commit":"ea2d2cb","metric":4.2905,"metrics":{"loss_ema":4.0523,"flip_rate":1.180071e-3,"frac_zero_delta":-0.041134,"per_loop_gap":0.0596,"wall_seconds":33878,"val_step_500":5.5149,"val_step_1000":4.9175,"val_step_1500":4.5566,"val_step_2000":4.4252,"best_ema":3.9338,"best_ema_step":2221},"status":"keep","description":"MAIN 153M + full BPTT + CMuon lr=0.10 + cautious. val 4.2905 — NEW ALL-TIME CHAMPION. -0.49 vs Run 13 (lr=0.02), -2.62 vs baseline. Confirms lr=0.10 scales from fast-A.","timestamp":1780989750,"segment":0}
{"run":21,"commit":"ea2d2cb","metric":4.4436,"metrics":{"loss_ema":4.2054,"flip_rate":4.060115e-4,"frac_zero_delta":-0.038264,"per_loop_gap":0.0783,"wall_seconds":6710},"status":"keep","description":"FAST-A + full BPTT + CMuon lr=0.10 with cosine decay to 0.01. val 4.4436 — -0.057 vs Run 18 4.50. Cosine schedule on CMuon helps modestly.","timestamp":1780996620,"segment":0}
{"run":22,"commit":"ea2d2cb","metric":4.3607,"metrics":{"loss_ema":4.1128,"flip_rate":6.359988e-4,"frac_zero_delta":-0.068779,"per_loop_gap":0.0868,"wall_seconds":6738},"status":"keep","description":"FAST-A + CMuon lr=0.20 cosine to 0.02. val 4.3607 — best fast-A, -0.08 vs Run 21 (lr=0.10 cosine), -0.14 vs Run 18 (lr=0.10 constant). High peak + cosine wins.","timestamp":1781005101,"segment":0}
{"run":23,"commit":"ea2d2cb","metric":4.3566,"metrics":{"loss_ema":4.1175,"flip_rate":9.563150e-4,"frac_zero_delta":-0.080239,"per_loop_gap":0.0737,"wall_seconds":6542},"status":"keep","description":"FAST-A + CMuon lr=0.40 cosine to 0.04. val 4.3566 — tied with Run 22 (4.3607) within noise. LR/cosine plateau around 0.20-0.40.","timestamp":1781011762,"segment":0}
{"run":24,"commit":"ea2d2cb","metric":4.3638,"metrics":{"loss_ema":4.1153,"flip_rate":6.291977e-4,"frac_zero_delta":-0.071862,"per_loop_gap":0.0673,"wall_seconds":6645},"status":"discard","description":"FAST-A + CMuon lr=0.20 cosine + warmup 200. val 4.3638 vs Run 22 4.3607 (no warmup). Warmup is noise-level neutral. Recipe converged.","timestamp":1781019821,"segment":0}
{"run":25,"commit":"ea2d2cb","metric":4.1562,"metrics":{"loss_ema":3.9286,"flip_rate":2.346505e-4,"frac_zero_delta":-0.157986,"per_loop_gap":0.0327,"wall_seconds":29598,"val_step_500":5.5968,"val_step_1000":4.9280,"val_step_1500":4.5127,"val_step_2000":4.3158},"status":"keep","description":"MAIN 153M + full BPTT + CMuon lr=0.20 cosine to 0.02. val 4.1562 — NEW ALL-TIME CHAMPION. -0.134 vs Run 20 (lr=0.10 constant), -2.75 vs baseline (-39.8 pct). 15.8 pct trits flipped from zero — most trit motion of any run.","timestamp":1781069743,"segment":0}
{"run":26,"commit":"ea2d2cb","metric":4.3479,"metrics":{"loss_ema":4.1015,"flip_rate":6.443226e-4,"frac_zero_delta":-0.066868,"wall_seconds":5517},"status":"keep","description":"FAST-A + cycles 1x3 (no outer recurrence) + CMuon lr=0.20 cosine. val 4.3479 vs Run 22 (cycles 2x3) 4.3607 — tied within noise, 18 pct faster (5517s vs 6738s). Outer H cycle redundant!","timestamp":1781075378,"segment":0}
{"run":27,"commit":"ea2d2cb","metric":4.3524,"metrics":{"loss_ema":4.1252,"flip_rate":6.712061e-4,"frac_zero_delta":-0.043499,"wall_seconds":4464},"status":"keep","description":"FAST-A + cycles 1x1 (NO recurrence at all). val 4.3524 vs Run 26 (1x3) 4.3479 - tied. 34 pct faster than Run 22 (2x3) at 4464s vs 6738s. Recurrence not earning compute at 2500-step horizon.","timestamp":1781079923,"segment":0}
{"run":28,"commit":"ea2d2cb","metric":4.1706,"metrics":{"loss_ema":3.7973,"flip_rate":7.259198e-4,"frac_zero_delta":-0.101184,"per_loop_gap":0.3916,"wall_seconds":17380,"val_step_2500":4.5139,"val_step_3000":4.4372,"val_step_3500":4.3201,"val_step_4000":4.2440},"status":"keep","description":"FAST-A + cycles 2x3 for 5000 STEPS + lr=0.20 cosine. val 4.1706 — matches Run 25 main 153M! per_loop_gap=0.3916 (12x Run 25 at 2500 steps). User hypothesis confirmed: recurrence pays off LATE.","timestamp":1781125456,"segment":0}
{"run":29,"commit":"ea2d2cb","metric":4.1783,"metrics":{"loss_ema":3.8226,"flip_rate":7.505487e-4,"frac_zero_delta":-0.072309,"wall_seconds":8131},"status":"keep","description":"FAST-A + cycles 1x1 + 5000 steps. val 4.1783 vs Run 28 (2x3 same) 4.1706 — tied within noise, 53 pct FASTER (8131s vs 17380s). Even with per_loop_gap=0.39 in 2x3 showing real recurrence use, it converts to <0.01 nat advantage. 1x1 wins.","timestamp":1781155091,"segment":0}
{"run":30,"commit":"ea2d2cb","metric":0,"metrics":{"step_at_interrupt":200,"reason":"User pivot to variable-loop recurrence research"},"status":"discard","description":"MAIN 153M + 1x1 + 5000 steps. INTERRUPTED at step 200 to pivot research direction to variable-loop fixpoint regularization.","timestamp":1781156304,"segment":0}
{"run":31,"commit":"ea2d2cb","metric":4.1863,"metrics":{"loss_ema":3.8215,"flip_rate":7.092005e-4,"frac_zero_delta":-0.101956,"per_loop_gap":0.0037,"wall_seconds":19522,"val_step_3500":4.3380,"val_step_4000":4.2440},"status":"keep","description":"FAST-A + variable H_cycles in [1,4] each step + 5000 steps. val 4.1863 — matches fixed runs (Run 28 2x3 4.17, Run 29 1x1 4.18). KEY: per_loop_gap=0.0037 vs Run 28 0.39 — 100x lower. Model converged to TRUE FIXED-POINT. Recurrence behaves as iterative refinement as HRM theory predicts.","timestamp":1781178392,"segment":0}
{"run":32,"commit":"cc165f1","metric":4.1910,"metrics":{"loss_ema":3.8169,"flip_rate":7.141113e-4,"frac_zero_delta":-0.102919,"per_loop_gap":0.0164,"wall_seconds":30463,"val_step_3500":4.3393,"val_step_4000":4.2520,"val_step_4500":4.1977,"val_step_5000":4.1910},"status":"keep","description":"FAST-A + variable H_cycles in [1,8] (wider) + 5000 steps. val 4.1910 — tied with Run 31 [1,4] (4.1863) and fixed runs (Run 28/29 ~4.17) within noise. per_loop_gap=0.0164: ~24x below fixed 2x3 (0.39), so the fixpoint property is ROBUST to a 2x wider loop range. BUT gap is 4x larger than [1,4]'s 0.0037 AND wall=30463s (+56pct vs [1,4] 19522s) since [1,8] averages 4.5 H-cycles/step vs 2.5. Confirmatory, not better: [1,4] is the sweet spot for cleanest fixpoint at least cost.","timestamp":1781208980,"segment":0}
{"run":33,"commit":"9fe156e","metric":4.1873,"metrics":{"loss_ema":3.8178,"flip_rate":7.135134e-4,"frac_zero_delta":-0.102050,"per_loop_gap":0.0049,"wall_seconds":18801,"val_step_5000":4.1873,"sweep_final":{"c1":4.1989,"c2":4.1873,"c4":4.1873,"c8":4.1871,"c16":4.1871,"c24":4.1871,"c32":10.8125}},"status":"keep","description":"FAST-A var H_cycles [1,4] + test-time cycle sweep. val 4.1873 (=Run 31/32, recipe unchanged). KEY RESULT (test-time loop extrapolation): val is FLAT to +/-0.0002 from cyc2..cyc24 — a TRUE stable fixed point, stable to 6x the training max (24 vs [1,4]). cyc1=4.1989 (one iter under-converged). NO test-time compute scaling: extra loops hold loss, don't lower it. cyc32=10.8125=ln(V): collapse to degenerate constant fixed point (attention over-smoothing over ~96 stack-apps). So ternary recurrence forms a clean wide-basin fixpoint (not brittle) but is stable-not-improving and over-smooths past ~24 loops.","timestamp":1781234000,"segment":0}
{"run":34,"commit":"d71c6f4","metric":6.3229,"metrics":{"loss_ema":6.1441,"flip_rate":null,"wall_seconds":19749,"val_step_500":6.8624,"val_step_1000":6.7468,"val_step_1500":6.6289,"val_step_2000":6.6156,"val_step_2500":6.5320,"val_step_3000":6.4763,"val_step_3500":6.4228,"val_step_4000":6.3748,"val_step_4500":6.3296,"val_step_5000":6.3229,"sweep_final":{"c1":6.3255,"c2":6.3229,"c3":6.3227,"c4":6.3227,"c6":6.3227,"c8":6.3227,"c12":6.3227,"c16":10.8125,"c24":10.8125,"c32":10.8125,"c48":null,"c64":null}},"status":"discard","description":"FP-WEIGHTS CONTROL: mirrors r033 EXACTLY but --fp-weights (CMuon on raw FP weight, no STE/quantize/scales). val 6.3229 — much worse than ternary r033 4.1873 (+2.14 nats). Cycle sweep IDENTICAL shape to ternary: flat fixpoint c2..c12, collapse c16=10.8125, NaN by c48. NOT a clean precision verdict yet: lr=0.20 was tuned for ternary latents in [-1,1] and looks too hot for LeCun-scale FP (step-500 val 6.86 already underwater). Per ideas#G: sweep FP CMuon lr (0.05, 0.02, 0.01) before concluding. Discard from leaderboard (control line, not on ternary metric).","timestamp":1781286124,"segment":0}
{"run":35,"commit":"1d0e952","metric":5.5042,"metrics":{"loss_ema":5.1880,"flip_rate":0,"frac_zero_delta":-0.221493,"per_loop_gap":0.0045,"wall_seconds":15086,"val_step_500":6.0499,"val_step_1000":6.0664,"val_step_1500":5.9948,"val_step_2000":5.9452,"val_step_2500":5.8397,"val_step_3000":5.7376,"val_step_3500":5.6438,"val_step_4000":5.5571,"val_step_4500":5.5224,"val_step_5000":5.5042,"sweep_final":{"c1":5.5098,"c2":5.5042,"c3":5.5043,"c4":5.5043,"c6":5.5044,"c8":5.5044,"c12":5.5044,"c16":5.5044,"c24":10.8125,"c32":10.8125,"c48":10.8125,"c64":null}},"status":"keep","description":"FP CMuon-LR sweep leg 1: lr=0.05 cosine. val 5.5042 — HUGE improvement vs r034 lr=0.20 (6.3229, -0.82 nats), confirming lr was the main issue. Still +1.32 nats behind ternary r033 4.1873. Stable fixpoint widened to c2..c16 (vs r034 c2..c12, collapse pushed from c16→c24). Trajectory still descending steeply at step 5000 (cosine floor), so FP optimum not yet found. flip_rate=0 because trits frozen via --freeze-scales but quantize disabled by --fp-weights. Off ternary leaderboard (control line).","timestamp":1781302062,"segment":0}
{"run":36,"commit":"d59f15f","metric":5.9207,"metrics":{"loss_ema":5.6367,"flip_rate":7.847377e-07,"frac_zero_delta":-0.421903,"per_loop_gap":0.0023,"wall_seconds":15034,"val_step_500":6.6407,"val_step_1000":6.5892,"val_step_1500":6.4407,"val_step_2000":6.3299,"val_step_2500":6.2157,"val_step_3000":6.1213,"val_step_3500":6.0499,"val_step_4000":5.9630,"val_step_4500":5.9312,"val_step_5000":5.9207,"sweep_final":{"c1":5.9252,"c2":5.9207,"c3":5.9206,"c4":5.9206,"c6":5.9207,"c8":5.9207,"c12":5.9207,"c16":5.9207,"c24":10.8125,"c32":10.8125,"c48":null,"c64":null}},"status":"discard","description":"FP CMuon-LR sweep leg 2 (bisect): lr=0.10 cosine. val 5.9207 — worse than r035 lr=0.05 (5.5042) by +0.42. Confirms FP optimum is at-or-below 0.05, NOT bracketed by 0.05-0.20. Monotone trend r034(6.32)→r036(5.92)→r035(5.50). Stable cycle range c2..c16 same as r035. First run had transient cudaErrorLaunchFailure at step ~50 (driver glitch, same config worked on retry). Off ternary leaderboard.","timestamp":1781378048,"segment":0}
{"run":37,"commit":"30a90bc","metric":4.1575,"metrics":{"loss_ema":3.7870,"flip_rate":0,"frac_zero_delta":-0.009614,"per_loop_gap":0.0185,"wall_seconds":15495,"val_step_500":5.3027,"val_step_1000":4.7932,"val_step_1500":4.5981,"val_step_2000":4.5103,"val_step_2500":4.3940,"val_step_3000":4.3283,"val_step_3500":4.2559,"val_step_4000":4.1977,"val_step_4500":4.1702,"val_step_5000":4.1575,"sweep_final":{"c1":4.1711,"c2":4.1575,"c3":4.1575,"c4":4.1575,"c6":4.1575,"c8":4.1576,"c12":4.1576,"c16":4.1576,"c24":10.8125,"c32":10.8125,"c48":10.8125,"c64":null}},"status":"keep","description":"FP CMuon-LR sweep leg 3: lr=0.02 cosine. val 4.1575 — BEATS ternary r033 (4.1873) by 0.030 nats. Sweep trend: 6.32(0.20)→5.92(0.10)→5.50(0.05)→4.16(0.02). Per-loop gap 0.0185 vs ternary 0.0049 (looser fixpoint but still 1/20 of fixed-cycle). Stable cycle range c2..c16, collapse c24 (same shape as r035). Trajectory still descending step 4500→5000 (-0.013). Answers ideas#F definitively: FP and ternary BOTH form a fixpoint at this scale, FP slightly wins at its own optimum LR. So recurrence is NOT brittle because of ternary; the ~0.03-nat ternary deficit is a true precision tax, not a recurrence-vs-precision artefact. Off ternary leaderboard (FP control line) but biggest data point of the sweep.","timestamp":1781394015,"segment":0}
{"run":38,"commit":"a0dc153","metric":3.8782,"metrics":{"loss_ema":3.4974,"flip_rate":0,"frac_zero_delta":-0.000143,"per_loop_gap":0.0123,"wall_seconds":15175,"val_step_500":5.2339,"val_step_1000":4.6242,"val_step_1500":4.3826,"val_step_2000":4.2668,"val_step_2500":4.1148,"val_step_3000":4.0484,"val_step_3500":3.9724,"val_step_4000":3.9144,"val_step_4500":3.8876,"val_step_5000":3.8782,"sweep_final":{"c1":3.8867,"c2":3.8782,"c3":3.8785,"c4":3.8784,"c6":3.8785,"c8":3.8785,"c12":3.8785,"c16":3.8785,"c24":3.8785,"c32":10.8125,"c48":null,"c64":null}},"status":"keep","description":"FP CMuon-LR sweep leg 4: lr=0.01 cosine. val 3.8782 — NEW BEST OF FP LINE, -0.31 vs ternary r033 4.1873, -0.28 vs r037 lr=0.02. Sweep still monotone-down: 6.32(0.20)→5.92(0.10)→5.50(0.05)→4.16(0.02)→3.88(0.01). Stable cycle range expanded to c2..c24 (collapse pushed to c32, vs r037's c24 collapse). Per-loop gap 0.0123 (tighter than r037 0.0185 and ternary 0.0049 only 2.5x off). Trajectory still descending step 4500→5000 (-0.0094). Hypothesis: CMuon-LR optimum scales as 1/weight-init-magnitude; for hidden=512 LeCun init ~0.044, scaling ternary's 0.20 gives ~0.009 ≈ here. Off ternary leaderboard.","timestamp":1781448329,"segment":0}
{"run":39,"commit":"c9a421b","metric":3.9194,"metrics":{"loss_ema":3.5426,"flip_rate":0,"frac_zero_delta":-0.000002,"per_loop_gap":0.0138,"wall_seconds":15427,"val_step_500":5.3250,"val_step_1000":4.7278,"val_step_1500":4.4008,"val_step_2000":4.3005,"val_step_2500":4.1398,"val_step_3000":4.0791,"val_step_3500":4.0104,"val_step_4000":3.9555,"val_step_4500":3.9280,"val_step_5000":3.9194,"sweep_final":{"c1":3.9278,"c2":3.9194,"c3":3.9196,"c4":3.9196,"c6":3.9196,"c8":3.9195,"c12":3.9195,"c16":3.9195,"c24":3.9195,"c32":10.8125,"c48":null,"c64":null}},"status":"keep","description":"FP CMuon-LR sweep leg 5: lr=0.005 cosine. val 3.9194 — WORSE than r038 lr=0.01 (3.8782) by +0.041. Sweep flips from monotone-down to local minimum at r038 → FP OPTIMUM BRACKETED at lr=0.01. Final sweep: 6.32(.20)→5.92(.10)→5.50(.05)→4.16(.02)→3.88(.01)→3.92(.005). Settles ideas#F: recurrence is NOT brittle from ternary; FP and ternary form the same fixpoint regime (same stable c2..c24 width). FP-vs-ternary precision tax: 0.31 nats (~7pct relative). Inverse-LeCun-scale LR hypothesis confirmed: 0.20*0.044=0.0088 matches r038 optimum. Off ternary leaderboard. Pivoting back to ternary research.","timestamp":1781467161,"segment":0}
