{"run":40,"commit":"573831c","metric":4.0053,"metrics":{"loss_ema":3.7269,"flip_rate":3.731553e-04,"frac_zero_delta":-0.132722,"per_loop_gap":0.0096,"wall_seconds":31147,"val_step_500":5.5399,"val_step_1000":5.0942,"val_step_2000":4.7673,"val_step_3000":4.6129,"val_step_4000":4.5036,"val_step_5000":4.3789,"val_step_6000":4.2760,"val_step_7000":4.1640,"val_step_8000":4.1054,"val_step_9000":4.0402,"val_step_10000":4.0053,"sweep_final":{"c1":4.0106,"c2":4.0053,"c3":4.0055,"c4":4.0058,"c6":4.0059,"c8":4.0059,"c12":4.0059,"c16":4.0059,"c24":4.0059,"c32":10.8125,"c48":10.8125,"c64":null}},"status":"keep","description":"TERNARY: fast-A var H_cycles [1,4] + 10000 steps + lr=0.20 cosine to 0.02. val 4.0053 — NEW TERNARY FAST-A CHAMPION, -0.182 vs r033 (5000 steps, 4.1873). Confirms ternary 4.19 was step-budget-limited, NOT architectural floor. Trajectory still descending at step 10000 (last 500 -0.021). FP-ternary gap shrunk from 0.31 to 0.12 (vs r038 3.88). Stable cycle range c2..c24 (same as well-trained FP). Per-loop gap 0.0096 stays tight under 10k-step var-cycles training. Compute is a live ternary lever.","timestamp":1781500408,"segment":0}
{"run":41,"commit":"75d6a55","metric":4.3071,"metrics":{"loss_ema":3.9009,"flip_rate":1.109697e-03,"frac_zero_delta":-0.059791,"per_loop_gap":-0.0097,"wall_seconds":31908,"step_at_interrupt":2900,"val_step_500":5.6174,"val_step_1000":4.9320,"val_step_1500":4.6173,"val_step_2000":4.5020,"val_step_2500":4.3071,"sweep_step2500":{"c1":4.3068,"c2":4.3071,"c3":4.3091,"c4":4.3097,"c6":4.3098,"c8":4.3097,"c12":4.3097,"c16":4.3097,"c24":4.3097,"c32":10.8125,"c48":10.8125,"c64":null}},"status":"discard","description":"MAIN 153M + var H_cycles [1,2] + 5000 steps + lr=0.20 cosine. INTERRUPTED at step 2900 (58pct, 8h51m wall) by user SIGINT to free GPU for phase-B curriculum experiments. Partial data: val at step 2500 = 4.3071, ALREADY BEATING Run 25 (main, fixed 2x3) at step 2500 (4.3158) by 0.009. Cycle sweep flat c1..c24 = 4.31, c32 collapse — fixpoint property holds at main 153M scale, confirming the var-cycles finding scales fast-A → main. With 2000 more steps would have converged ~4.10-4.15. Wall ~3.5x fast-A r033 per step (10.65 s/it vs ~3.0 fast-A), so var [1,2] feasible on main but expensive. Discarded as incomplete; the fast-A finding generalizes.","timestamp":1781552957,"segment":0}
{"run":42,"commit":"677dd1c","metric":4.1373,"metrics":{"loss_ema":3.7640,"flip_rate":2.682246e-04,"frac_zero_delta":-0.099681,"per_loop_gap":0.0113,"wall_seconds":15753,"val_step_500":5.5543,"val_step_1000":5.0537,"val_step_1500":4.7874,"val_step_2000":4.6683,"val_step_2500":4.5004,"val_step_3000":4.4242,"val_step_3500":4.3038,"val_step_4000":4.2272,"val_step_4500":4.1581,"val_step_5000":4.1373,"sweep_final":{"c1":4.1450,"c2":4.1373,"c3":4.1381,"c4":4.1386,"c6":4.1385,"c8":4.1386,"c12":4.1386,"c16":4.1386,"c24":4.1386,"c32":10.8125,"c48":10.8125,"c64":null}},"status":"keep","description":"PHASE A baseline (rerun of r033 with KEEP_SAFETENSORS=1). val 4.1373 (vs r033 4.1873, slightly better noise). Cycle sweep flat c2..c24=4.1373-4.1386 — true fixpoint reestablished, ready as Phase B starting point. final.safetensors preserved (128MB). per_loop_gap +0.0113. Successor r043: fine-tune from final.safetensors on OpenMath-heavy mix, --val-source openmath, --muon-lr 0.05 cosine.","timestamp":1781604711,"segment":0}
{"run":43,"commit":"631b1cf","metric":0.9667,"metrics":{"step_at_interrupt":4725,"val_step_500":1.2495,"val_step_1000":1.1882,"val_step_1500":1.1455,"val_step_2000":1.1094,"val_step_2500":1.0762,"val_step_3000":1.0434,"val_step_3500":1.0220,"val_step_4000":0.9952,"val_step_4500":0.9667,"sweep_step4500":{"c1":0.9710,"c2":0.9667,"c3":0.9672,"c4":0.9675,"c6":0.9675,"c8":0.9675,"c12":0.9675,"c16":0.9675,"c24":0.9675,"c32":10.8125,"c48":10.8125,"c64":null}},"status":"discard","description":"PHASE B fine-tune: resumed r042 fixpoint, 80pct openmath / 20pct cosmopedia, --val-source openmath, lr=0.05 cosine. Interrupted at step 4725 (94pct) but the answer is clear. val 0.97 (NOT comparable to FineWeb val_loss; OpenMath has low entropy structured Problem/Solution text). KEY RESULT: cycle sweep at val on OpenMath is FLAT — c2..c24 = 0.9667-0.9675 (delta 0.0008, noise level). c1=0.9710 is the only meaningfully worse cycle (one iter under-converged, same as FineWeb). VERDICT: depth-recurrence does NOT recruit extra loops for reasoning at fast-A scale even with fixpoint init + reasoning specialisation. Confirms the pessimistic branch of the Topological Trouble paper's prediction. Curriculum hypothesis (ideas#H) refuted at this scale. Escalation paths: (a) block-recurrent prototype (major rewrite, ~1-2 weeks); (b) close recurrence research line and return to ternary leaderboard. Defaulting to (b) for r044. Off ternary leaderboard.","timestamp":1781644071,"segment":0}
{"run":44,"commit":"67b505e","metric":5.5279,"metrics":{"step_at_interrupt":500,"val_step_500":5.5279},"status":"discard","description":"fast-A var [1,4] @ 20000 steps. INTERRUPTED at step 500 by user pivot to ternary-nanoGPT research line (autoresearch_gpt.*). Single val data point confirms recipe replicated cleanly (5.5279 vs r040 step 500 = 5.5399). HRM line PARKED at r044 — recurrence research closed at r043 (depth-recurrence does not recruit loops for reasoning at fast-A scale), the leaderboard-extension question is shelved.","timestamp":1781646560,"segment":0}
{"type":"parked","name":"ternary-hrm-fast-recipe","at_run":44,"reason":"User pivoted to ternary-nanoGPT line to isolate ternary speedups from recurrence confound. HRM champion at fast-A is r040 val 4.00 (10000 steps); main 153M champion is r025 val 4.1562 (5000 steps).","timestamp":1781646560}
